{
  "schema_version": 1,
  "locale": "ru",
  "expectation": "Я задам четыре коротких вопроса, покажу полную рекомендацию и дождусь вашего одобрения, прежде чем что-либо добавлять. Можно выбрать один или несколько номеров или написать свой вариант.",
  "question_heading": "Вопрос {number} из {total}",
  "footer": "Выберите один или несколько номеров или напишите свой вариант.",
  "normalizing": "Спасибо. Сейчас я сопоставлю ваши формулировки с исследовательскими возможностями.",
  "confirmation_retry": "Ответьте «да», чтобы подтвердить всю рекомендацию, или «нет», чтобы остановиться без установки.",
  "installing": "Спасибо. Устанавливаю подтверждённые исследовательские возможности и проверю их, прежде чем сообщить о готовности.",
  "declined": "Ничего не установлено. Вы сможете заново начать настройку в любой момент.",
  "installation_failed": "Настройку не удалось безопасно завершить. Я не буду сообщать о готовности, пока установленное состояние не подтверждено.",
  "completion": "Evidence Lab готов. Откройте новую задачу, чтобы приложение загрузило новые исследовательские возможности. Начните её с того, над чем хотите работать; повторять настройку не потребуется."
}
